{"version":"v1","license":"CC BY 4.0","product":"Cursor","page":"https://archestack.com/alternatives/cursor/","categories":[{"list":"best-of-vibe-coding","id":"coding-agents","title":"Coding agents and assistants","url":"https://archestack.com/api/v1/categories/best-of-vibe-coding/coding-agents.json"}],"picks":[{"id":"best-of-vibe-coding/claw-code","name":"claw-code","url":"https://archestack.com/api/v1/projects/best-of-vibe-coding/claw-code.json","page":"https://archestack.com/best-of-vibe-coding/projects/claw-code/","place":1,"score":83,"tagline":"Rust CLI coding agent harness using Anthropic and OpenAI-compatible APIs","source_url":"https://archestack.com/best-of-vibe-coding/projects/claw-code/","checked_at":"2026-10-14","own_claim":false},{"id":"best-of-vibe-coding/opencode","name":"opencode","url":"https://archestack.com/api/v1/projects/best-of-vibe-coding/opencode.json","page":"https://archestack.com/best-of-vibe-coding/projects/opencode/","place":2,"score":79,"tagline":"Terminal coding agent with build and plan modes, plus a desktop app","source_url":"https://archestack.com/best-of-vibe-coding/projects/opencode/","checked_at":"2026-10-14","own_claim":false},{"id":"best-of-vibe-coding/orca","name":"orca","url":"https://archestack.com/api/v1/projects/best-of-vibe-coding/orca.json","page":"https://archestack.com/best-of-vibe-coding/projects/orca/","place":3,"score":77,"tagline":"Desktop app that runs CLI coding agents in parallel git worktrees","source_url":"https://archestack.com/best-of-vibe-coding/projects/orca/","checked_at":"2026-10-14","own_claim":false},{"id":"best-of-vibe-coding/oh-my-openagent","name":"oh-my-openagent","url":"https://archestack.com/api/v1/projects/best-of-vibe-coding/oh-my-openagent.json","page":"https://archestack.com/best-of-vibe-coding/projects/oh-my-openagent/","place":4,"score":77,"tagline":"Terminal coding agent that fans work out across many models","source_url":"https://archestack.com/best-of-vibe-coding/projects/oh-my-openagent/","checked_at":"2026-10-14","own_claim":false},{"id":"best-of-vibe-coding/openinterpreter","name":"openinterpreter","url":"https://archestack.com/api/v1/projects/best-of-vibe-coding/openinterpreter.json","page":"https://archestack.com/best-of-vibe-coding/projects/openinterpreter/","place":5,"score":76,"tagline":"Terminal coding agent, a Codex fork tuned for low-cost models","source_url":"https://archestack.com/best-of-vibe-coding/projects/openinterpreter/","checked_at":"2026-10-14","own_claim":false},{"id":"best-of-vibe-coding/herdr","name":"herdr","url":"https://archestack.com/api/v1/projects/best-of-vibe-coding/herdr.json","page":"https://archestack.com/best-of-vibe-coding/projects/herdr/","place":6,"score":76,"tagline":"Terminal multiplexer that keeps coding agents running and shows which are blocked","source_url":"https://archestack.com/best-of-vibe-coding/projects/herdr/","checked_at":"2026-10-14","own_claim":false},{"id":"best-of-vibe-coding/gemini-cli","name":"gemini-cli","url":"https://archestack.com/api/v1/projects/best-of-vibe-coding/gemini-cli.json","page":"https://archestack.com/best-of-vibe-coding/projects/gemini-cli/","place":7,"score":75,"tagline":"Terminal coding agent that runs Gemini models with file, shell and MCP tools","source_url":"https://archestack.com/best-of-vibe-coding/projects/gemini-cli/","checked_at":"2026-10-14","own_claim":false},{"id":"best-of-vibe-coding/openhands","name":"OpenHands","url":"https://archestack.com/api/v1/projects/best-of-vibe-coding/openhands.json","page":"https://archestack.com/best-of-vibe-coding/projects/openhands/","place":8,"score":75,"tagline":"Web control center for running coding agents and scheduled automations","source_url":"https://archestack.com/best-of-vibe-coding/projects/openhands/","checked_at":"2026-10-14","own_claim":false},{"id":"best-of-vibe-coding/codewhale","name":"codewhale","url":"https://archestack.com/api/v1/projects/best-of-vibe-coding/codewhale.json","page":"https://archestack.com/best-of-vibe-coding/projects/codewhale/","place":9,"score":75,"tagline":"Terminal coding agent that works with hosted or local models","source_url":"https://archestack.com/best-of-vibe-coding/projects/codewhale/","checked_at":"2026-10-14","own_claim":false},{"id":"best-of-vibe-coding/deepseek-reasonix","name":"deepseek-reasonix","url":"https://archestack.com/api/v1/projects/best-of-vibe-coding/deepseek-reasonix.json","page":"https://archestack.com/best-of-vibe-coding/projects/deepseek-reasonix/","place":10,"score":75,"tagline":"Coding agent for terminal, desktop, browser and VS Code, written in Go","source_url":"https://archestack.com/best-of-vibe-coding/projects/deepseek-reasonix/","checked_at":"2026-10-14","own_claim":false}]}